title,cast,country,date_added,release_year,rating,duration,listed_in,description
The Book of Pooh,"Jim Cummings, Paul Tiesler, Jeff Bennett, Peter Cullen, Stephanie d’Abruzzo, John Fiedler",United States,"November 12, 2019",2000,TV-Y,2 Seasons,"Comedy, Kids",Pooh and Friends discover Christopher Robin’s storybook filled with endearing tales about them!
The Evermoor Chronicles,"Naomi Sequeira, Finney Cassidy, Georgia Lock, Jordan Loughran, George Sear, Georgie Farmer","United Kingdom, United States","May 29, 2020",2015,TV-PG,2 Seasons,"Coming of Age, Fantasy, Mystery",Tara is trying to settle into a strange village.
The Ghost and Molly McGee,"Ashly Burch, Dana Snyder",United States,"October 6, 2021",2021,TV-Y7,1 Season,"Animation, Buddy, Coming of Age",A grumpy ghost and cheerful tween are eternally bound.
The Greeks,Toby Moore,United States,"June 5, 2020",2016,TV-PG,1 Season,"Docuseries, Historical","Quite simply, the Greeks created our world."
The Incredible Dr. Pol,"Rick Robles, Dr. Pol",United States,"September 8, 2021",2011,TV-14,19 Seasons,"Animals & Nature, Docuseries, Family",Dr. Pol and his team handle challenging veterinary cases and animal emergencies in central Michigan.
The Incredible Hulk,"Neal McDonough, John Vernon, Luke Perry, Lou Ferrigno, Genie Francis",United States,"May 10, 2021",1996,TV-Y7,2 Seasons,"Action-Adventure, Animation, Kids",Scientist Bruce Banner develops a dangerous alter ego – a monster known as the Incredible Hulk.
The Lodge,"Sophie Simnett, Luke Newton, Thomas Doherty, Bethan Wright, Jayden Revri, Jade Alleyne",United Kingdom,"January 15, 2020",2016,TV-G,2 Seasons,"Coming of Age, Drama, Musical",A city girl starts a new life in the country.
The Mandalorian,"Pedro Pascal, Carl Weathers, Gina Carano, Omid Abtahi, Nick Nolte",United States,"October 30, 2020",2019,TV-14,2 Seasons,"Action-Adventure, Family, Science Fiction","After the fall of the Empire, a lone gunfighter makes his way through the lawless galaxy."
The Muppet Show,"Jim Henson, Frank Oz, Dave Goelz, Richard Hunt, Eren Ozker, John Lovelady","United States, United Kingdom","February 19, 2021",1976,TV-PG,5 Seasons,"Comedy, Family, Variety",It's time to raise the curtain on The Muppet Show!
The Muppets (Series),"Bill Barretta, Dave Goelz, Eric Jacobson, Peter Linz, David Rudman, Matt Vogel",United States,"November 12, 2019",2015,TV-PG,1 Season,Comedy,"""The Muppets"" return with a documentary-style show."
The Mysterious Benedict Society,"Tony Hale, Kristen Schaal, Mystic Inscho, Seth Carr, Marta Kessler, Emmy DeOliveira",United States,"June 25, 2021",2021,TV-PG,1 Season,"Action-Adventure, Family",Four gifted orphans are recruited by the eccentric Mr. Benedict to save the world.
The New Adventures of Winnie the Pooh,"Jim Cummings, Paul Winchell, John Fiedler, Ken Sansome, Tim Hoskins, Patty Paris",United States,"November 12, 2019",1988,TV-Y,4 Seasons,"Animation, Kids",The stories of Winnie the Pooh and friends.
The Proud Family,"Tommy Davidson, Paula Parker, Jo Payton, Kyla Pratt, Tara Strong, Karen White",United States,"January 1, 2020",2001,TV-G,2 Seasons,"Animation, Comedy, Coming of Age","Follow the adventures of Penny, a typical African American girl navigating through teen-dom."
The Replacements,"Nancy Cartwright, Grey DeLisle, Kath Soucie, Daran Norris, David McCallum, Jeff Bennett",United States,"November 12, 2019",2006,TV-G,1 Season,"Animation, Comedy, Family","Riley and Todd, can replace any adult in their life by making a simple call to the Fleemco company."
The Right Stuff,"Jake McDorman, Patrick Adams, Colin O’Donoghue, Eloise Mumford, James Lafferty, Nora Zehetner",United States,"October 9, 2020",2020,TV-14,1 Season,"Drama, Historical",The incredible story of the Mercury Seven astronauts and their extraordinary achievements.
The Rocketeer,"Kitana Turnbull, Billy Campbell, Kathy Najimy, Callan Farris, Frank Welker",United States,"October 16, 2020",2019,TV-Y,1 Season,"Action-Adventure, Animation, Kids",Kit becomes a rocket-pack wearing superhero!
The Simpsons,"Dan Castellaneta, Julie Kavner, Nancy Cartwright, Yeardley Smith, Hank Azaria, Pamela Hayden",United States,"September 29, 2021",1989,TV-PG,32 Seasons,"Animation, Comedy","The world’s favorite nuclear family, in the award-winning, history-making series."
The Suite Life of Zack & Cody,"Cole Sprouse, Dylan Sprouse, Brenda Song, Ashley Tisdale, Phill Lewis, Kim Rhodes",United States,"November 12, 2019",2004,TV-G,3 Seasons,"Action-Adventure, Comedy, Coming of Age",Twin brothers Zack and Cody get to live with their single mom in Boston's swankiest hotel.
The Suite Life On Deck,"Cole Sprouse, Dylan Sprouse, Brenda Song, Debby Ryan, Phill Lewis",United States,"November 12, 2019",2008,TV-G,3 Seasons,"Action-Adventure, Comedy, Coming of Age","Zack and Cody Martin are aboard the SS Tipton, a luxury passenger cruise liner."
The Super Hero Squad,"Grey DeLisle, Steve Blum, Mikey Kelly, Charlie Adler, Mark Hamill, Tom Kenny",United States,"January 1, 2020",2009,TV-Y7,2 Seasons,"Action-Adventure, Animation, Comedy",The greatest heroes on the planet unite to face the greatest villains in the Super Hero Squad.
The Wonderful World of Mickey Mouse,"Chris Diamantopoulos, Kaitlyn Robrock, Bill Farmer, Tony Anselmo, Tress MacNeille",United States,"November 18, 2020",2020,TV-G,1 Season,"Action-Adventure, Animation, Anthology",It's nothing but fun for Mickey and friends as they embark on their greatest adventures yet.
The World According to Jeff Goldblum,Jeff Goldblum,United States,"November 12, 2019",2019,TV-PG,2 Seasons,Docuseries,Jeff Goldblum explores the fascinating science and history of deceptively familiar objects.
Timon & Pumbaa,"Quinton Flynn, Ernie Sabella, Jim Cummings, Nathan Lane",United States,"November 12, 2019",1995,TV-Y,3 Seasons,"Animation, Buddy, Comedy","Timon, a meerkat, and Pumbaa, a warthog, join together for misadventures in the jungle."
Tron Uprising,"Elijah Wood, Bruce Boxleitner, Emmanuelle Chriqui, Mandy Moore, Nate Corddry, Lance Henriksen",United States,"April 14, 2020",2011,TV-Y7,1 Season,"Action-Adventure, Animation, Kids","Inside the computer world of the grid, Beck becomes the unlikely leader of a revolution."
Tut's Treasures: Hidden Secrets,Mark Bazeley,United Kingdom,"April 10, 2020",2018,TV-PG,1 Season,"Docuseries, Historical",The pharaoh’s priceless grave goods are being reunited for the first time since their discovery.
United States Of Animals,Quincy Dunn-Baker,United States,"May 1, 2020",2015,TV-PG,1 Season,"Animals & Nature, Docuseries, Family",United States of Animals takes you on a fascinating journey across the United States.
Unlikely Animal Friends,Mark Keller,United States,"May 1, 2020",2012,TV-G,3 Seasons,"Animals & Nature, Docuseries, Family",This series reveals the stories of unlikely duos that have struck up unusual relationships.
Violetta,"Diego Ramos, Martina Stoessel, Pablo Espinosa, Jorge Blanco, Mercedes Lambre, Nicolás Garnier",Argentina,"September 18, 2020",2011,TV-G,3 Seasons,"Coming of Age, Drama, Music",Violetta is a talented teen following her dream.
Walk the Prank,"Cody Veith, Bryce Gheisar, Brandon Severs, Jillian Shea Spaeder, Tobie Windham",United States,"April 2, 2021",2016,TV-Y7,3 Seasons,"Comedy, Reality",Chance and his crew prank unsuspecting targets.
WandaVision,"Elizabeth Olsen, Paul Bettany, Teyonah Parris, Kathryn Hahn, Randall Park, Kat Dennings",United States,"January 15, 2021",2021,TV-14,1 Season,"Drama, Fantasy, Mystery",Two super-powered beings living idealized suburban lives suspect that everything is not as it seems.
Wander Over Yonder,"Jack McBrayer, April Winchell, Keith Ferguson, Tom Kenny","United States, Canada, Ireland","May 7, 2021",2013,TV-Y7,2 Seasons,Comedy,Best friends travel through the cosmos.
Weird But True!,"Charlie Engelman, Kirby Engelman",United States,"August 14, 2020",2017,TV-G,3 Seasons,"Animals & Nature, Kids, Variety","Come along as we reveal fun, strange & surprising facts about our world in Weird But True!"
When Sharks Attack,Eric Meyers,United States,"July 9, 2021",2013,TV-14,7 Seasons,Reality,National Geographic investigates shark attacks.
Wicked Tuna,Mike Rowe,United States,"May 28, 2021",2016,TV-14,10 Seasons,"Action-Adventure, Animals & Nature, Docuseries",Massachusetts fishermen make their living one catch at a time in pursuit of the bluefin tuna.
Wild Cats of India,James Murray,United States,"August 14, 2020",2020,TV-PG,1 Season,"Animals & Nature, Docuseries, Family",Journey across the country’s landscapes to paint an intimate portrait of India's Wild Cats.
Wild Chile,Peter Venn,United Kingdom,"July 17, 2020",2017,TV-PG,1 Season,"Animals & Nature, Docuseries, Family",This beautiful and intriguing blue-chip series explores the incredibly varied wildlife of Chile.
Wild Hawaii,JK Simmons,United States,"June 5, 2020",2014,TV-PG,1 Season,"Animals & Nature, Docuseries, Family",National Geographic takes us on an untamed journey to Hawaii's remarkable lands.
Wild Sri Lanka,Paul McGann,United Kingdom,"July 24, 2020",2016,TV-PG,1 Season,"Animals & Nature, Docuseries",This three-part series reveals the spectacular nature and amazing wildlife of Sri Lanka.
Wild Yellowstone,Bart Thomasson,Germany,"November 12, 2019",2015,TV-PG,1 Season,"Animals & Nature, Docuseries, Travel",Wild Yellowstone captures the beauty and essence of the land and animals.
Wizards of Waverly Place,"Selena Gomez, David Henrie, Jake Austin, Jennifer Stone, Maria Canals-Barrera, David DeLuise",United States,"November 12, 2019",2007,TV-G,4 Seasons,"Comedy, Coming of Age, Fantasy","Alex, Justin, and Max Russo are not your ordinary teenagers – they’re secretly wizards in training!"
Wolverine and The X-Men,"Steve Blum, Chris Edgerly, Jennifer Hale, Michael Ironside, Danielle Judovits, AJ Buckley",United States,"November 12, 2019",2008,TV-Y7,1 Season,"Action-Adventure, Animation, Kids",Wolverine and the X-Men must join together to prevent a catastrophic future.
X-Men: Evolution,"Noel Fisher, Vincent Gale, Christopher Judge, David Kaye, Scott McNeil, Meghan Black",United States,"November 12, 2019",2000,TV-Y7,4 Seasons,"Action-Adventure, Animation, Kids",X-Men: Evolution features the team as teenagers as they fight for a world that fears and hates them.
Year Million,Laurence Fishburne,United States,"January 1, 2020",2016,TV-PG,1 Season,"Docuseries, Science Fiction","Explore what human life might be like, one million years into the future."
