title,cast,country,date_added,release_year,rating,duration,listed_in,description
101 Dalmatian Street,"Josh Brener, Michaela Dietz, Ella Kenion, Rhashan Stone","United Kingdom, United States, Canada","February 28, 2020",2018,TV-Y7,1 Season,"Action-Adventure, Animation, Comedy",Pups Dolly and Dylan adventure to find their spots.
Alaska Animal Rescue,Victoria Vosburg,United States,"September 1, 2021",2019,TV-PG,2 Seasons,"Animals & Nature, Docuseries, Family",Conservation heroes rescue and rehabilitate the wild animals of America’s last frontier.
Alaska's Grizzly Gauntlet,Les Stroud,United States,"June 5, 2020",2018,TV-PG,1 Season,"Animals & Nature, Docuseries, Family",Survival expert Les Stroud explores the world of Alaska’s most formidable wildlife.
America's Funniest Home Videos,Tom Bergeron,United States,"April 24, 2020",1989,TV-PG,9 Seasons,"Comedy, Family, Fantasy",Home videos compete for cash prizes. Program is presented as originally created.
America's National Parks,C.T. Taylor,United States,"January 15, 2020",2015,TV-14,1 Season,"Animals & Nature, Docuseries",Experience the breathtaking landscapes and majestic animals of eight U.S. National Parks.
American Dragon: Jake Long,"Dante Basco, Jeff Bennett, Amy Bruckner, John DiMaggio, Charlie Finn, Kittie",United States,"February 26, 2021",2004,TV-Y7,2 Seasons,"Action-Adventure, Animation, Comedy",Jake strives to find balance in his life as a New York teen learning to master his mystical powers.
Ancient China from Above,Dr. Allan Maca,United States,"September 18, 2020",2020,TV-14,1 Season,"Docuseries, Historical",Archaeologist Allan Maca reveals the amazing wonders of Ancient China like never before.
Andi Mack,"Peyton Lee, Joshua Rush, Sofia Wylie, Asher Angel, Lilan Bowden, Lauren Tom",United States,"November 12, 2019",2016,TV-G,3 Seasons,"Comedy, Coming of Age, Drama","Andi's life is shaken by her sister, Bex's, surprise."
Animal ER,Dr. Brian Beale,United States,"July 3, 2020",2016,TV-PG,2 Seasons,"Animals & Nature, Docuseries, Family",Animal ER brings you up close to the bleeding edge of animal care.
Austin & Ally,"Ross Lynch, Laura Marano, Raini Rodriguez, Calum Worthy",United States,"January 1, 2020",2011,TV-G,4 Seasons,"Comedy, Coming of Age, Kids","Austin, a musician, and Ally, a songwriter, form a team."
Best Friends Whenever,"Lauren Taylor, Shelby Bender, Gus Kamp, Ricky Garcia, Benjamin Royer, Matthew Royer",United States,"November 12, 2019",2015,TV-G,2 Seasons,"Buddy, Comedy, Coming of Age",Best friends gain the ability to travel through time!
Bia,"Isabela Souza, Giulia Guerrini, Julio Peña, Guido Messina, Andrea de Alba, Agustina Palma",Argentina,"November 20, 2020",2019,TV-G,1 Season,"Coming of Age, Drama, Music","Bia is filled with passion, after the loss of her sister she will rediscover music and find love."
Big City Greens,"Chris Houghton, Marieve Herington, Bob Joles, Artemis Pebdani","United States, South Korea","May 21, 2021",2017,TV-Y7,2 Seasons,"Action-Adventure, Animation, Comedy",The Green family moves from the country to Big City.
Billy Dilley's Super-Duper Subterranean Summer,"Aaron Springer, Catherine Wayne, Tom Kenny",United States,"January 1, 2020",2016,TV-Y7,1 Season,"Animation, Comedy, Fantasy",Billy and his friends get stuck inside Earth's core.
Birth of Europe,Mark Halliley,United Kingdom,"May 1, 2020",2014,TV-G,1 Season,Docuseries,Birth of Europe reveals the extraordinary story of how Europe has been created by Nature’s forces.
Bluey,"Dave Mccormack, Melanie Zanetti, Brad Elliot, Hsiao-Ling Tang","Australia, United Kingdom","May 28, 2021",2019,TV-Y,2 Seasons,"Animation, Kids","Bluey is a six year-old Blue Heeler dog, who turns everyday family life into adventures."
Bonkers,"Charlie Adler, Corey Burton, Jesse Corti, Jim Cummings, Frank Welker, Gregg Berger","United States, Hong Kong, South Korea, France, Canada, China, United Kingdom, Australia, Japan, Taiwan, Philippines","November 12, 2019",1993,TV-G,1 Season,"Animation, Comedy, Kids",A washed-up cartoon star begins a new life as the first toon cop in Hollywood.
Boy Meets World,"Ben Savage, William Daniels, Betsy Randle, Will Friedle, Rider Strong, Lee Norris",United States,"November 12, 2019",1993,TV-PG,7 Seasons,"Comedy, Coming of Age, Family","Adolescent Cory Matthews grows up, and faces problems with friends, family, and school."
Brain Games,Neil Harris,United States,"April 17, 2020",2011,TV-G,8 Seasons,"Docuseries, Family, Game Show / Competition",Brain Games features games & experiments revealing the science of how your brain works.
Breaking Bobby Bones,Bobby Bones,United States,"July 7, 2021",2021,TV-14,1 Season,"Action-Adventure, Docuseries, Reality",Bobby Bones travels to meet local heroes who challenge him to conquer their trades.
Chicken Squad,"Ramone Hamilton, Gabriella Graves, Maxwell Simkins, Yvette Nicole Brown",United States,"August 11, 2021",2021,TV-Y,1 Season,"Animation, Kids, Police/Cop",BAGAWK! Say hello to the Chicken Squad.
Chip 'n Dale's Rescue Rangers,"Corey Burton, Peter Cullen, Jim Cummings, Tress MacNeille","United States, Taiwan, South Korea, China, Japan, United Kingdom","November 12, 2019",1989,TV-G,1 Season,"Action-Adventure, Animation, Comedy",Chip and Dale head a small group of animal characters who monitor the human and animal communities.
Continent 7: Antarctica,Chris Browning,United States,"January 15, 2020",2016,TV-PG,1 Season,"Action-Adventure, Animals & Nature, Docuseries",Experience how science is conducted as scientists and survival experts join forces in Antarctica.
Coop & Cami Ask The World,"Ruby Turner, Dakota Lotus, Olivia Sanabia, Albert Tsai, Paxton Booth, Rebecca Metz",United States,"September 18, 2020",2018,TV-G,2 Seasons,"Comedy, Family, Kids","Cooper and Cami Wrather co-host ""Would You Wrather."""
Cosmos: A Spacetime Odyssey,"Neil Tyson, Stoney Emshwiller",United States,"July 10, 2020",2013,TV-PG,1 Season,"Action-Adventure, Docuseries, Family",A 13-part adventure across the universe of space and time.
Cosmos: Possible Worlds,Neil deGrasse Tyson,United States,"December 25, 2020",2020,TV-14,1 Season,"Action-Adventure, Docuseries, Family",COSMOS: POSSIBLE WORLDS continues Carl Sagan’s legacy that began more than 40 years ago.
Crash & Bernstein,"Cole Jensen, Tim Lagasse, Landry Bender, Oana Gregory, Aaron Landon",United States,"November 12, 2019",2012,TV-Y7,2 Seasons,"Comedy, Fantasy, Kids","The only boy in a family, Wyatt creates a puppet brother."
Critter Fixers: Country Vets,Sullivan Jones,United States,"July 28, 2021",2020,TV-14,2 Seasons,"Animals & Nature, Docuseries, Family",Dr. Hodges and Dr. Ferguson own and operate a bustling veterinary clinic.
Darkwing Duck,"Jim Cummings, Christine Cavanaugh, Terry McGovern, Frank Welker",United States,"November 12, 2019",1991,TV-Y7,2 Seasons,"Action-Adventure, Animation, Kids","Darkwing Duck tells the adventures of the superhero, aided by his sidekick Launchpad McQuack."
Diary of a Future President,"Tess Romero, Selenis Leyva, Charlie Bushnell, Michael Weaver",United States,"January 17, 2020",2020,TV-PG,2 Seasons,"Comedy, Coming of Age, Family","Elena Cañero-Reed will one day become the U.S. President, but for now, she’s in middle school."
Dino Ranch,"Tyler Nathan, Jacob Mazeral, Ava Ro, Scott Gorman, Athena Karkanis",Canada,"June 18, 2021",2021,TV-Y,1 Season,"Animation, Kids, Western","Join the Cassidy family on their ""prewestoric"" farm!"
Disney A.N.T. Farm,"China McClain, Sierra McCormick, Jake Short, Stefanie Scott, Carlon Jeffery",United States,"June 26, 2020",2011,TV-G,3 Seasons,"Comedy, Coming of Age, Music",Chyna Sparks and her friends are the newest members of the A.N.T. program.
Disney Amphibia,"Justin Felbinger, Amanda Leighton, Bill Farmer, Brenda Song","United States, South Korea","November 3, 2021",2018,TV-Y7,3 Seasons,"Animation, Comedy, Family",Anne Boonchuy is transported to the world of Amphibia.
Disney Big Hero 6 The Series,"Scott Adsit, Ryan Potter, Brooks Wheelan, Jamie Chung, Khary Payton, Genesis Rodriguez",United States,"March 19, 2021",2017,TV-G,3 Seasons,"Action-Adventure, Animation, Kids","Hiro, Baymax and team protect the city from villains."
Disney Bizaardvark,"Madison Hu, Olivia Rodrigo, Jake Paul, DeVore Ledridge, Ethan Wacker",United States,"November 12, 2019",2015,TV-PG,3 Seasons,"Buddy, Comedy, Family",Paige and Frankie produce an online comedy channel.
Disney Fam Jam,"Phil Wright, Ariel Martin, Trevor Tordjman",United States,"January 8, 2021",2020,TV-G,1 Season,"Family, Game Show / Competition, Reality",Families across America compete in epic dance battles!
Disney Fancy Nancy,"Mia Jenness, Alyson Hannigan, Rob Riggle, Spencer Moss, Dana Heath","United States, Canada","November 12, 2021",2018,TV-PG,3 Seasons,"Animation, Kids",Nancy makes every day extraordinary!
Disney Fast Layne,"Sophie Pollono, Sofia Rosinsky, Brandon Rossel, Winslow Fegley",United States,"November 12, 2019",2018,TV-G,1 Season,"Action-Adventure, Animation, Comedy",Twelve-year-old Layne Reed discovers a talking car.
Disney Gallery / Star Wars: The Mandalorian,"Jon Favreau, Dave Filoni, Pedro Pascal, Bryce Howard, Taika Waititi, Carl Weathers",United States,"December 25, 2020",2020,TV-PG,2 Seasons,"Action-Adventure, Docuseries, Family",DISNEY GALLERY / STAR WARS: THE MANDALORIAN is a docuseries about the making of The Mandalorian.
Disney Gravity Falls,"Kristen Schaal, Jason Morgan, Alex Hirsch",United States,"November 12, 2019",2011,TV-Y7,2 Seasons,"Action-Adventure, Animation, Comedy",Dipper and Mabel spend the summer with Grunkle Stan.
Disney I Didn't Do It,"Olivia Holt, Austin North, Piper Curda, Peyton Clark, Sarah Gilman",United States,"March 20, 2020",2013,TV-G,2 Seasons,"Comedy, Family",Fraternal twins try to explain exactly what just happened.
Disney Jake and the Never Land Pirates,"Madison Pettis, Colin Ford, Jonathan Heit, David Arquette, Corey Burton",United States,"November 12, 2019",2010,TV-Y,4 Seasons,"Action-Adventure, Animation, Fantasy",Jake sails for a treasure hunt against Captain Hook.
Disney JONAS,"Kevin Jonas, Joe Jonas, Nick Jonas, Chelsea Staub, Nicole Anderson, John Ducey",United States,"November 12, 2019",2008,TV-G,2 Seasons,"Comedy, Family, Kids","JONAS is the hottest rock band on the planet! Band members Nick, Kevin, and Joe are superstar idols."
Disney Junior T.O.T.S.,"Vanessa Williams, Megan Hilty, Jet Jurgensmeyer, Christian Simon",United States,"July 28, 2021",2018,TV-Y,2 Seasons,"Animation, Buddy, Kids",Pip and Freddy are new Junior Fliers at T.O.T.S.!
Disney Just Roll With It,"Ramon Reed, Kaylin Hayman, Suzi Barrett, Tobie Windham",United States,"June 18, 2021",2018,TV-Y7,2 Seasons,"Comedy, Family",This family's fate rests in the hands of the audience!
Disney K.C. Undercover,"Zendaya , Veronica Dunne, Kamil McFadden, Tammy Townsend, Kadeem Hardison",United States,"November 12, 2019",2014,TV-Y7,3 Seasons,"Action-Adventure, Comedy, Kids",K.C. joins her spy family as its newest secret agent.
Disney Lab Rats: Elite Force,"William Brent, Bradley Perry, Jake Short, Paris Berelc, Kelli Berglund",United States,"November 12, 2019",2015,TV-Y7,1 Season,"Action-Adventure, Comedy, Coming of Age",The Lab Rats join forces with the Mighty Med team.
Disney Legend of the Three Caballeros,"Tony Anselmo, Jaime Camil, Eric Bauza, Grey Griffin, Wayne Knight, Kevin Richardson",United States,"November 12, 2019",2017,TV-G,1 Season,"Action-Adventure, Animation, Comedy","Donald, Jose and Panchito inherit a magical atlas and travel the world battling mythical monsters."
Disney Mickey Mouse Clubhouse,"Wayne Allwine, Jim Cummings, Russi Taylor, Tony Anselmo, Bill Farmer, Tress MacNeille",United States,"November 12, 2019",2005,TV-Y,5 Seasons,"Animation, Kids",Mickey leads kids on an interactive adventure of learning.
Disney Milo Murphy's Law,"Al Yankovic, Sabrina Carpenter, Mekai Curtis",United States,"November 12, 2019",2016,TV-Y7,2 Seasons,"Action-Adventure, Animation, Comedy","Around Milo, anything that can go wrong, will."
Disney Prop Culture,Daniel Lanigan,United States,"May 1, 2020",2020,TV-PG,1 Season,Docuseries,"Collector Dan Lanigan reunites iconic Disney movie props with filmmakers, actors, and crew."
Disney Randy Cunningham: 9th Grade Ninja,"Ben Schwartz, Andrew Caldwell, Tim Curry, John DiMaggio, Kevin Richardson, Dave Wittenberg","United Kingdom, United States, Ireland","January 15, 2020",2011,TV-Y7,2 Seasons,"Action-Adventure, Animation, Comedy",Randy is an average freshman until he is chosen as The Ninja.
Disney Raven's Home,"Raven-Symoné , Issac Brown, Navia Robinson, Jason Maybaum, Sky Katz, Anneliese van der Pol",United States,"July 2, 2021",2016,TV-G,4 Seasons,"Comedy, Family, Fantasy",Raven and Chelsea raise their three children together.
Disney Star vs. the Forces of Evil,"Eden Sher, Adam McArthur",United States,"December 1, 2019",2014,TV-Y7,4 Seasons,"Action-Adventure, Animation, Comedy",Star battles villains throughout the multiverse.
Disney Stuck In The Middle,"Jenna Ortega, Ronni Hawk, Isaak Presley, Ariana Greenblatt, Kayla Maisonet, Nicolas Bechtel",United States,"November 12, 2019",2015,TV-PG,3 Seasons,"Comedy, Coming of Age, Family",Harley is stuck in the middle of a family with 7 kids!
Disney Sydney To The Max,"Ruth Righi, Ava Kolker, Jackson Dollinger, Christian Simon, Ian Kesler, Caroline Rhea",United States,"May 28, 2021",2018,TV-G,3 Seasons,"Comedy, Coming of Age, Family",Sydney navigates middle school with help from her Dad.
Disney The Lion Guard,"Max Charles, Diamond White, Dusan Brown, Atticus Shaffer, Joshua Rush",United States,"December 3, 2019",2015,TV-Y,3 Seasons,"Action-Adventure, Animation, Comedy",The Lion Guard has assembled and now they will DEFEND!
Disney The Owl House,"Sarah-Nicole Robles, Wendie Malick, Alex Hirsch, Tati Gabrielle, Issac Brown, Mae Whitman","United States, United Kingdom","July 21, 2021",2020,TV-Y7,2 Seasons,"Action-Adventure, Animation, Anime",Luz stumbles upon a portal to a magical new world.
Disney Vampirina,"Isabella Crovetti, Lauren Graham, James Van Der Beek, Jordan Davis, Wanda Sykes, Mitchell Whitfield","Ireland, United States","September 29, 2021",2017,TV-Y7,3 Seasons,"Animation, Fantasy, Kids",Vampirina is the new girl in town!
Disney's Adventures Of The Gummi Bears,"Bill Scott, Christian Jacobs, Brett Johnson, David Faustino, Paul Winchell, Jason Marsden",United States,"November 12, 2019",1985,TV-Y7,6 Seasons,"Action-Adventure, Animation, Fantasy",The magical Gummi Bears discover their rich history.
Disney's Doug,"Connie Shulman, Doug Preis, Alice Playten, Chris Phillips, Fred Newman, Thomas McHugh",United States,"November 12, 2019",1996,TV-Y7,3 Seasons,"Animation, Comedy, Coming of Age","Doug uses his imagination to navigate through tests of friendship, love, school, and growing up."
Disney's Hercules: The Animated Series,"Tate Donovan, Sandra Bernhard, Robert Costanzo, Matt Frewer, Bobcat Goldthwait, French Stewart",United States,"November 12, 2019",1998,TV-Y7,1 Season,"Action-Adventure, Animation, Comedy",Follow Herc's many labors during the years he spent training on how to be a hero.
Disney's Kim Possible,"Christy Romano, Will Friedle, Nancy Cartwright, Tahj Mowry","United States, Philippines, South Korea","November 12, 2019",2001,TV-G,4 Seasons,"Action-Adventure, Animation, Comedy","Kim Possible is a high school girl who, in her spare time, saves the world from evil villains."
Disney's Little Einsteins,"Erica Huang, Aiden Pompey, Jesse Schwartz, Natalia Wojcik",United States,"November 12, 2019",2005,TV-Y,2 Seasons,"Action-Adventure, Animation, Kids",This innovative new series provides preschoolers with new ways to hear and see music and art.
Disney's Magic Bake-Off,"Issac Ryan Brown, Dara Reneé, Graciela Gomez",United States,"September 29, 2021",2021,TV-G,1 Season,"Family, Game Show / Competition",Kid bakers compete to be named Disney Baking Champion.
Disney's Mighty Ducks,"James Belushi, Brad Garrett, Jeff Bennett, Jennifer Hale, Clancy Brown, Tony Jay",United States,"November 12, 2019",1996,TV-Y7,1 Season,"Action-Adventure, Animation, Comedy",Hockey-loving alien ducks are stranded on Earth and must protect it from the evil Dragaunus.
Disney's Recess,"Rickey Collins, Jason Davis, Ashley Johnson, Ross Malinger, Courtland Mead, Pamela Segall",United States,"November 12, 2019",1997,TV-Y7,3 Seasons,"Animation, Comedy, Kids",A portrayal of life at Third Street Elementary School.
Disney's The Emperor's New School,"Shane Baumel, Jessica DiCicco, Wendie Malick, Fred Tatasciore, Jeff Bennett, Jessie Flower",United States,"November 12, 2019",2005,TV-G,2 Seasons,"Animation, Comedy, Coming of Age","Disney's The Emperor's New School is a unique comedy about Kuzco, a self-centered and spoiled teen."
Disney's The Little Mermaid (Series),"Jodi Benson, Samuel Wright, Ken Mars, Edan Gross",United States,"November 12, 2019",1992,TV-Y7,3 Seasons,"Action-Adventure, Animation, Fantasy","Follow Ariel's adventures as a mermaid living under the sea with her father, King Triton."
Doc McStuffins,"Kiara Muhammad, Jaden Betts, Jess Harnell, Kimberly Brooks, Lara Miller, Loretta Devine","United States, Ireland","May 22, 2020",2011,TV-Y7,5 Seasons,"Animation, Kids, Medical",Doc McStuffins has a clinic for toys in her playhouse.
Dog Whisperer with Cesar Millan,Cesar Millan,United States,"November 12, 2019",2004,TV-G,6 Seasons,"Animals & Nature, Docuseries, Family",World-renowned dog expert Cesar Millan helps dogs and their owners overcome behavior issues.
Dog With a Blog,"G Hannelius, Blake Michael, Francesca Capaldi, Stephen Full, Regan Burns, Beth Littleford",United States,"February 26, 2021",2012,TV-G,3 Seasons,"Comedy, Fantasy",Tyler and Avery hide the fact that their new dog can talk.
Dog: Impossible,Matt Beisner,United States,"September 22, 2021",2019,TV-PG,2 Seasons,"Animals & Nature, Docuseries, Family",Matt Beisner uses unique approaches to modifying canine behavior and focuses on each animal’s needs.
"Doogie Kamealoha, M.D.","Peyton Elizabeth Lee, Emma Meisel, Matthew Sato, Wes Tian, Jeffrey Bowyer-Chapman, Mapuana Makia",United States,"September 8, 2021",2021,TV-PG,1 Season,"Comedy, Coming of Age, Family",A 16-year-old prodigy juggles her budding medical career with the daily challenges of teenage life.
"Dr. Oakley, Yukon Vet","Dr. Michelle Oakley, Zachary Fine",United States,"November 17, 2021",2013,TV-PG,10 Seasons,"Action-Adventure, Animals & Nature, Docuseries","Meet Dr. Michelle Oakley, vet to pretty much everything that moves in the rugged Yukon."
"Dr. T, Lone Star Vet",Dr. Lauren Thielen,United States,"November 12, 2019",2019,TV-PG,1 Season,"Docuseries, Family, Medical","Dr. T, Lone Star Vet follows Dr. T as she faces the most compelling cases of her career."
Drain the Oceans,Russell Boulter,"United Kingdom, Australia","October 6, 2021",2017,TV-PG,4 Seasons,"Docuseries, Historical",Pull the plug on the ocean to reveal hidden secrets using groundbreaking technology.
DuckTales,"David Tennant, Danny Pudi, Ben Schwartz, Bobby Moynihan, Kate Micucci, Tony Anselmo",United States,"April 30, 2021",2017,TV-Y7,3 Seasons,"Action-Adventure, Animation, Comedy",Join Scrooge and family on globe-trotting adventures!
Dug Days,"Bob Peterson, Ed Asner, Jordan Nagai",United States,"September 1, 2021",2021,TV-PG,1 Season,"Animation, Comedy, Family","“Dug Days” is a collection of shorts that follows the adventures of Dug, the dog from Pixar’s “Up.”"
Elena of Avalor,"Aimee Carrero, Jenna Ortega, Keith Ferguson, Jillian Reed, Carlos Alazraqui, Mikey Kelley",United States,"January 15, 2021",2015,TV-Y7,3 Seasons,"Action-Adventure, Animation, Fantasy",Elena of Avalor must learn to rule!
Encore!,"Kristen Bell, Roger Love, Susan Egan, Ali Stroker, Stephen Schwartz",United States,"November 12, 2019",2019,TV-14,1 Season,"Music, Reality",Kristen Bell reunites former high school classmates to re-stage musicals they performed in the past.
Europe from Above,Julian Barratt,United Kingdom,"September 18, 2020",2019,TV-G,1 Season,"Docuseries, Reality",Europe from Above takes to the air over Europe’s finest cultural and geographical landmarks.
Even Stevens,"Shia LaBeouf, Christy Romano, Nick Spano, Tom Virtue, Donna Pescow",United States,"November 12, 2019",2000,TV-PG,3 Seasons,"Comedy, Coming of Age, Kids","Louis, a seventh-grade misfit, struggles to fit in at school and in his seemingly perfect family."
Fairy Tale Weddings,"Stephen Boss, Allison Holker",United States,"February 14, 2020",2017,TV-PG,2 Seasons,"Docuseries, Family, Lifestyle",A behind-the-scenes look at Disney's magical weddings.
Fantastic Four (Series),"Beau Weaver, Lori Alan, Chuck McCann, Brian Green, Stan Lee, Pauline Lomas",United States,"November 12, 2019",1994,TV-Y7,1 Season,"Action-Adventure, Animation, Kids","Reed Richards, Sue and Johnny Storm and pilot Ben Grimm are transformed into the Fantastic Four."
Fantastic Four: World's Greatest Heroes,"Christopher Jacot, Hiro Kanagawa, Lara Gilchrist, Brian Dobson",United States,"November 12, 2019",2007,TV-Y7,1 Season,"Action-Adventure, Animation, Kids","Watch Mr. Fantastic, Invisible Woman, Human Torch, and Thing as they battle their greatest foes."
Fish Hooks,"Chelsea Kane, Kyle Massey, Justin Roiland",United States,"April 3, 2020",2010,TV-G,3 Seasons,"Animation, Comedy, Coming of Age","Milo, Bea and Oscar are three BFFs, best fish friends."
Future-Worm!,"Andy Milonakis, James Adomian, Corey Burton, Melanie Lynskey, Ryan Quincy, Neil deGrasse Tyson",United States,"April 9, 2021",2016,TV-Y7,1 Season,"Family, Kids","One boy, one worm... these are their adventures!"
Gabby Duran And The Unsittables,"Kylie Cantrall, Maxwell Donovan, Callan Farris, Coco Christo, Valery Ortiz, Nathan Lovejoy",United States,"August 11, 2021",2018,TV-G,2 Seasons,"Comedy, Family, Science Fiction","Meet Gabby Duran, your average alien-babysitting girl."
Gargoyles,"Thom Hernandez, Edward Asner, Jeff Bennett, Keith David, Bill Fagerbakke, Jonathan Frakes",United States,"November 12, 2019",1994,TV-Y7,3 Seasons,"Action-Adventure, Animation, Fantasy","In Scotland, 994 A.D. Goliath and his clan of gargoyles defend a medieval castle."
Gathering Storm,Tucker McDougall,United States,"October 23, 2020",2020,TV-PG,1 Season,"Animals & Nature, Docuseries","Witness first hand stories combined with scientific insight, analysis and satellite mapping."
Gigantosaurus,"Dylan Schombing, Áine Sunderland, Nahanni Mitchell, Nicholas Holmes",France,"August 25, 2021",2018,TV-Y,2 Seasons,"Action-Adventure, Animation, Kids",Four dinos explore the mystery of the Gigantosaurus!
Girl Meets World,"Rowan Blanchard, Ben Savage, Sabrina Carpenter, Peyton Meyer, August Maturo, Danielle Fishel",United States,"November 12, 2019",2013,TV-G,3 Seasons,"Comedy, Coming of Age, Family",Riley and Maya traverse the twists of teenage years.
Goldie & Bear,"Georgie Kidder, Justine Huxley, Natalie Lander, Jim Cummings, David Kaufman, David Lodge",United States,"November 6, 2020",2015,TV-Y,2 Seasons,"Action-Adventure, Animation, Buddy",Goldie and Bear go on adventures in Fairytale Forest.
Good Luck Charlie,"Bridgit Mendler, Leigh-Allyn Baker, Bradley Perry, Mia Talerico, Eric Kramer, Jason Dolley",United States,"November 12, 2019",2009,TV-G,4 Seasons,"Comedy, Coming of Age, Family",The Duncans are a typical family whose lives are turned topsy-turvy with the arrival of Charlie
Goof Troop,"Nancy Cartwright, Jim Cummings, Dana Hill, Rob Paulson, Corey Burton, Bill Farmer",United States,"November 12, 2019",1992,TV-Y7,1 Season,"Animation, Comedy, Kids","Goofy is a single father raising his son, Max in Spoonerville."
Gordon Ramsay: Uncharted,Gordon Ramsay,United States,"June 4, 2021",2018,TV-14,3 Seasons,"Action-Adventure, Docuseries, Lifestyle",Gordon Ramsay travels the globe on an epic adventure in search of culinary inspiration.
Great Migrations,Alec Baldwin,United States,"November 12, 2019",2010,TV-PG,1 Season,"Animals & Nature, Docuseries, Survival",An intimate and unprecedented view of animal migrations across the globe.
Handy Manny,"Wilmer Valderrama, Carlos Alazraqui, Dee Baker, Nika Futterman, Tom Kenny, Kath Soucie","United States, Canada","November 12, 2019",2006,TV-Y,3 Seasons,"Animation, Kids","Handy Manny and his box of friendly, silly tools are the go-to guys in their neighborhood."
Hannah Montana,"Miley Cyrus, Emily Osment, Mitchel Musso, Jason Earles, Billy Cyrus",United States,"November 12, 2019",2005,TV-G,4 Seasons,"Comedy, Coming of Age, Kids",Hannah Montana is a live-action comedy series that follows typical tween Miley Stewart.
"Heartland Docs, DVM","Dr. Erin Schroeder, Dr. Ben Schroeder",United States,"June 18, 2021",2019,TV-14,3 Seasons,"Animals & Nature, Docuseries, Family",Heartland vets Ben and Erin Schroeder live and work among farmers in the Midwest.
Henry Hugglemonster,"Lara Miller, Tom Kenny, Chiara Zanni, Lori Alan, Hynden Walch, Kari Wahlgren","Ireland, United Kingdom, United States, South Korea, Canada","December 1, 2019",2012,TV-Y,2 Seasons,"Animation, Fantasy, Kids",Hugglemonsters always find a way!
Higglytown Heroes,"Frankie Ryan Manriquez, Taylor Masamitsu, Liliana Mumy, Rory Thost, Edie McClurg","United States, South Korea","April 2, 2021",2004,TV-Y,2 Seasons,"Animation, Kids, Musical","You're invited to meet the heroes all around you, since everyone's a hero in their own way!"
High School Musical: The Musical: The Series,"Olivia Rodrigo, Joshua Bassett, Matt Cornett, Sofia Wylie, Larry Saperstein",United States,"November 12, 2019",2019,TV-PG,2 Seasons,"Comedy, Coming of Age, Drama","For the first time ever, East High Wildcats put on a production of High School Musical: The Musical!"
Hostile Planet,Bear Grylls,United States,"November 12, 2019",2019,TV-PG,1 Season,"Animals & Nature, Docuseries, Survival",Hostile Planet reveals the animal kingdom’s epic stories of survival in extreme environments.
